{
  "format": "still-pine.zenpack/v1",
  "id": "foundation-01",
  "version": "1.1.0",
  "title": "Foundation I — The Body That Sits",
  "shortTitle": "Foundation I",
  "tradition": "Sōtō Zen foundation with a personal pre-zazen kuji threshold",
  "description": "A first-week daily form that preserves your nine-seal threshold, uses brief susokukan as scaffolding, and places the center of gravity in uncontrived shikantaza.",
  "weeklyTeaching": "Practice and realization are not two.",
  "weeklyTeachingNote": "Do not grade the sitting by tranquility, silence, or attainment. Wholehearted return to sitting is the practice.",
  "session": {
    "title": "Daily Zazen — Foundation I",
    "stages": [
      {
        "id": "kuji",
        "kind": "Personal threshold · before zazen",
        "title": "Kuji threshold",
        "durationSec": 180,
        "instruction": "Begin in gasshō. Move through the nine seals without attaching invented powers or meanings. This is your threshold; zazen begins after it.",
        "secondary": "Two quiet breaths per seal is sufficient. Keep the seals precise, unhurried, and simple.",
        "substeps": [
          {
            "title": "Rin · 臨",
            "cue": "Dokko-in",
            "durationSec": 20,
            "imagePath": "./assets/kuji/01-rin.jpg",
            "imageAlt": "Hand seal diagram for Rin · 臨"
          },
          {
            "title": "Pyō · 兵",
            "cue": "Daikongō-in",
            "durationSec": 20,
            "imagePath": "./assets/kuji/02-pyo.jpg",
            "imageAlt": "Hand seal diagram for Pyō · 兵"
          },
          {
            "title": "Tō · 闘",
            "cue": "Sotojishi-in",
            "durationSec": 20,
            "imagePath": "./assets/kuji/03-to.jpg",
            "imageAlt": "Hand seal diagram for Tō · 闘"
          },
          {
            "title": "Sha · 者",
            "cue": "Uchijishi-in",
            "durationSec": 20,
            "imagePath": "./assets/kuji/04-sha.jpg",
            "imageAlt": "Hand seal diagram for Sha · 者"
          },
          {
            "title": "Kai · 皆",
            "cue": "Gebakuken-in",
            "durationSec": 20,
            "imagePath": "./assets/kuji/05-kai.jpg",
            "imageAlt": "Hand seal diagram for Kai · 皆"
          },
          {
            "title": "Jin · 陣",
            "cue": "Naibakuken-in",
            "durationSec": 20,
            "imagePath": "./assets/kuji/06-jin.jpg",
            "imageAlt": "Hand seal diagram for Jin · 陣"
          },
          {
            "title": "Retsu · 列",
            "cue": "Chiken-in",
            "durationSec": 20,
            "imagePath": "./assets/kuji/07-retsu.jpg",
            "imageAlt": "Hand seal diagram for Retsu · 列"
          },
          {
            "title": "Zai · 在",
            "cue": "Nichirin-in",
            "durationSec": 20,
            "imagePath": "./assets/kuji/08-zai.jpg",
            "imageAlt": "Hand seal diagram for Zai · 在"
          },
          {
            "title": "Zen · 前",
            "cue": "Ongyō-in / your established ninth seal",
            "durationSec": 20,
            "imagePath": "./assets/kuji/09-zen.jpg",
            "imageAlt": "Hand seal diagram for Zen · 前"
          }
        ]
      },
      {
        "id": "settling",
        "kind": "Entering zazen",
        "title": "Settle the body",
        "durationSec": 90,
        "instruction": "Return to gasshō and bow. Set the hokkaijōin. Upright spine, chin slightly tucked, shoulders released, eyes open and naturally lowered.",
        "secondary": "Take one full exhalation. Sway gently left and right, decreasing the movement until the body comes to rest in the center. Then stop adjusting.",
        "cues": [
          {
            "atSec": 42,
            "text": "Let the mouth close naturally; tongue lightly to the roof of the mouth. Breathe through the nose."
          },
          {
            "atSec": 67,
            "text": "Come to center. Nothing further needs to be arranged."
          }
        ]
      },
      {
        "id": "susokukan",
        "kind": "Attentional scaffold",
        "title": "Susokukan",
        "durationSec": 300,
        "instruction": "Let breathing be natural. At each completed exhalation, count silently from one to ten, then return to one.",
        "secondary": "Do not engineer a ratio, squeeze the abdomen, or target a breathing rate. If the count is lost or runs past ten, simply return to one. Nothing went wrong.",
        "cues": [
          {
            "atSec": 150,
            "text": "Feel the body breathing rather than manufacturing the breath."
          },
          {
            "atSec": 240,
            "text": "When distraction is recognized, return without commentary: one."
          }
        ]
      },
      {
        "id": "shikantaza",
        "kind": "Zazen",
        "title": "Shikantaza",
        "durationSec": 900,
        "instruction": "Release the count. Do not expand awareness, narrow it, chase silence, observe yourself observing, or try to produce mushin. Just remain sitting.",
        "secondary": "Thoughts may arise. Do not complete them and do not attack them. When you discover that thought has closed around you, open the hand of thought and return to the whole body sitting upright.",
        "cues": [
          {
            "atSec": 300,
            "text": "Nothing special is required. Sit upright; let phenomena come and go."
          },
          {
            "atSec": 600,
            "text": "Do not ask whether shikantaza is happening. Return to sitting."
          }
        ]
      },
      {
        "id": "closing",
        "kind": "Closing form",
        "title": "Leave slowly",
        "durationSec": 60,
        "instruction": "At the bell, bring the hands to gasshō and bow. Place the hands on the thighs. Take one fuller breath.",
        "secondary": "Sway gently, beginning small and becoming larger. Unfold the legs carefully and rise deliberately. Do not rush the transition.",
        "cues": [
          {
            "atSec": 35,
            "text": "If there is sharp pain or persistent numbness, move carefully. Zen does not require injuring the body."
          }
        ]
      }
    ]
  },
  "afterPractice": {
    "logPrompt": "What repeatedly captured the mind?",
    "inquiries": [
      "What was I trying to get from that sitting?",
      "What would the sitting have been if nothing whatsoever had been obtained?"
    ]
  },
  "study": {
    "assignedReadingIds": [
      "fukanzazengi-official",
      "fukanzazengi-notes"
    ],
    "contemplation": "What does it mean to study the self? Notice the recurring division between ‘me’ and ‘what is happening to me’ during ordinary life; do not turn this into an exercise during zazen."
  }
}
